{
  "$schema": "https://json-schema.org/draft/2020-12/schema",
  "$id": "board.schema.json",
  "title": "board.json",
  "description": "Metadata of a canonical board package (a ZIP with exactly `copper.gbr` and `board.json`). Made by `ingest`, read by `exposure` and `mill`. Lengths in millimetres, Y points up.",
  "type": "object",
  "required": ["schema_version", "name", "outline", "width_mm", "height_mm", "holes"],
  "properties": {
    "schema_version": {"const": 1},
    "name": {"type": "string", "minLength": 1, "maxLength": 40},
    "outline": {
      "description": "Bounding box of the board outline center lines in the coordinates of `copper.gbr`.",
      "type": "object",
      "required": ["xmin", "ymin", "xmax", "ymax"],
      "properties": {
        "xmin": {"type": "number"},
        "ymin": {"type": "number"},
        "xmax": {"type": "number"},
        "ymax": {"type": "number"}
      },
      "additionalProperties": false
    },
    "width_mm": {"type": "number", "exclusiveMinimum": 0, "description": "xmax - xmin, rounded to 0.1 mm."},
    "height_mm": {"type": "number", "exclusiveMinimum": 0, "description": "ymax - ymin, rounded to 0.1 mm."},
    "contour": {
      "description": "The real board shape from the outline layer (Edge.Cuts): the outer polygon and polygons of cutouts. Points in mm relative to the lower left corner of the outline box, the closing point is not repeated, arcs are approximated to 0.005 mm. A file with several boards (several outlines that are not inside each other) lists the largest one here and the others in `others`; the outline box and the size then cover all of them. Absent when the outline layer is not made of closed loops of lines and arcs: the board is then taken as its box.",
      "type": "object",
      "required": ["outer", "cutouts"],
      "properties": {
        "outer": {"$ref": "#/$defs/polygon"},
        "cutouts": {"type": "array", "items": {"$ref": "#/$defs/polygon"}},
        "others": {
          "description": "Further boards in the same file, each with its own outer polygon and cutouts.",
          "type": "array",
          "items": {
            "type": "object",
            "required": ["outer", "cutouts"],
            "properties": {
              "outer": {"$ref": "#/$defs/polygon"},
              "cutouts": {"type": "array", "items": {"$ref": "#/$defs/polygon"}}
            },
            "additionalProperties": false
          }
        }
      },
      "additionalProperties": false
    },
    "copper": {
      "description": "Simple copper geometry for the layout preview of the frontend, in mm relative to the lower left corner of the outline (like `holes`). Only dark polarity objects; arcs are cut into short pieces. Absent when the board has too much copper to draw. `exposure` and `mill` ignore it.",
      "type": "object",
      "required": ["strokes", "discs", "polygons"],
      "properties": {
        "strokes": {
          "description": "Tracks: x1, y1, x2, y2, width, drawn with round ends.",
          "type": "array",
          "items": {"type": "array", "items": {"type": "number"}, "minItems": 5, "maxItems": 5}
        },
        "discs": {
          "description": "Round pads and vias: x, y, diameter.",
          "type": "array",
          "items": {"type": "array", "items": {"type": "number"}, "minItems": 3, "maxItems": 3}
        },
        "polygons": {"type": "array", "items": {"$ref": "#/$defs/polygon"}, "description": "Filled shapes: rectangular pads, copper pours."}
      },
      "additionalProperties": false
    },
    "holes": {
      "type": "array",
      "items": {
        "type": "object",
        "required": ["x_mm", "y_mm", "diameter_mm", "plated"],
        "properties": {
          "x_mm": {"type": "number", "description": "Distance from the left edge of the outline."},
          "y_mm": {"type": "number", "description": "Distance from the bottom edge of the outline."},
          "diameter_mm": {"type": "number", "exclusiveMinimum": 0},
          "plated": {"type": "boolean"}
        },
        "additionalProperties": false
      }
    }
  },
  "additionalProperties": false,
  "$defs": {
    "polygon": {
      "type": "array",
      "minItems": 3,
      "items": {"type": "array", "items": {"type": "number"}, "minItems": 2, "maxItems": 2}
    }
  }
}
